pp1.ID,pp1.class,pp1.lrnA,pp1.stn,pp1.sStn,pp1.subSStn,pp1.lsn,pp1.slo,pp1.sle,pp1.kiq,pp1.cc,pp1.pci,pp1.cv,pp1.ola,pp1.csa,pp1.nfa,pp1.asm,pp1.tlr,pp1.nts,pp1.ree,pp1.rme,pp1.rae,pp1.rbe
11,"Pre-Primary One","Language Activities","2.0 Speaking","2.5 Passing information",NULL,"1 hour","By the end of the sub-strand, the learner should be able to:
a) Convey verbal messages effectively to the teacher and to other learners.
b) Use relevant vocabulary to pass verbal information to the teacher and other learners.
c) Enjoy passing verbal messages to the teacher and other learners.","Learners could be encouraged to talk to each other or to the teacher about themselves.
Learners could deliver verbal messages to other learners or to teachers in the school and be appreciated when they convey the messages effectively.
In pairs or small groups, learners could tell and retell news and short stories.
Learners could engage in dialogue with each other and among themselves.
Learners should be involved in passing verbal information whenever opportunities arise.
Learners could engage short discussions and be encouraged to answer questions.
Learners could talk about what they are doing during activities and be guided to ask and respond to questions.
Learners could view a video clip and then talk about it in pairs or in small groups.
Learners could be encouraged to talk about what they saw in a field trip or nature walk. ","1. What do learners talk about in class or in school?
2. What do learners like to tell the teacher about?
3. What opportunities arise for learners to talk to each other?
4. What do learners enjoy talking about?
5. What do learners like to talk to each other about?","Digital literacy, communication and collaboration.","Citizenship: Social integration
Life skills: Effective communication, self-awareness, self-esteem.",Unity.,"Environmental and Social Activities.","Take the learners for a visit to a neighboring school. After the visit, engage the learners in talking about who they met, what they saw, and what they heard","Learners practise passing information through singing games during interclass competition.","Oral questions, observations, portfolio","Video clips, realia, posters, cards, phones(real or locally made), pictures, charts",NULL,"Consistently passes information accurately and effectively.","Passes information accurately and effectively most of the time.","Passes information accurately and effectively sometimes.","With guidance, passes information but not accurately or effectively."
12,"Pre-Primary One","Language Activities","2.0 Speaking","2.6 Naming",NULL,"4 Hours","By the end of the sub-strand, the learner should be able to:
a) Name objects, people, animals and colours in the immediate environment.
b) Take pleasure in naming objects, people, animals and colours in the immediate environment.","Learners could be involved in naming objects, animals and people in class and within the school compound.
Learners could recite poems and rhymes about objects, people and colours.
Learners could name colours with reference to objects in the environment.
Learners could be engaged in identifying colours in the immediate environment.
Learners could be taken for a nature walk and encouraged to identify colours.
Learners could be engaged in vocabulary games and encouraged to use new words by integrating them their child play and daily experiences, and naturally weaving them in and out of conversations with learners.
Learners could be involved in viewing video clips or animation to help them connect words with meaning.","1. Which people are we likely to find at home, in school, at the market or in a hospital?
2. What objects are we likely to find at home, in school, at the market or in a hospital?","Digital literacy, learning to learn, communication and collaboration","Citizenship: Social integration
Life skills: Effective communication, Self-awareness",Unity,"Psychomotor and Creative Activities, Environmental and Social Activities","Learners could bring assorted items from home to be donated to a needy family. Encourage learners to name these items.","Take learners for a walk around the school compound as they collect rubbish and put it in the dustbins. Guide them to name objects, people, animals and colours they come across.","Oral questions, observation, portfolio","Objects, language games, pictures, charts, learning corners",NULL,"Consistently names objects, people and colours with a variety of vocabulary.","Uses appropriate vocabulary to name objects, people and colours most of the time","Names some objects, people and colours appropriately.","Names some objects, people and colours with guidance."
13,"Pre-Primary One","Language Activities","2.0 Speaking","2.7 Articulation of Letter Sounds",NULL,"4 Hours","By the end of the sub-strand, the learner should be able to:
a) Articulate vowels correctly in and out of school.
b) Articulate consonants correctly in and out of school.
c) Demonstrate awareness of letter-sound correspondence in class.
d) Take pleasure in articulating vowels and consonants in and out of school.","Learners could observe charts with all the letters of the alphabet on the wall.
Learners could be guided to recite letters of the alphabet.
Learners could observe and imitate articulation of vowel sounds (a, e, i, o, u) after watching a demonstration.
Learners could be encouraged to articulate letter sounds after the teacher.
Learners could be encouraged to practise articulating vowel sounds.
Learners could be engaged in singing songs, reciting poems and rhymes relating to vowel sounds 
Learners should be encouraged to practise articulating consonant sounds.
Learners could be engaged in singing songs, reciting poems and rhymes relating to consonant sounds.
In pairs or small groups, learners could be engaged in activities such as sound articulation games e.g. fishing games, skittle games, dice games among others to enhance sound  articulation.
Learners could articulate through use of flash cards, charts, child's play and daily experiences.
Learners could be engaged in viewing recorded clips of letter sounds and illustrations to help them connect letters with their respective sounds.
Learners could listen to sound clips and manipulate other interactive programmes that enhance letter sound articulation.
Learners could be guided to relate the upper case (capital) letters and the lower case (small) letters with corresponding sounds.","1. How do different letters sound?
2. What is the sound corresponding to each upper case (capital) letter and its equivalent lower case (small) letter?
3. Which activities provide opportunities for learners to articulate specific letter sounds?","Learning to learn, digital literacy, communication and collaboration","Citizenship: Social integration
Life skills: Effective communication.",Unity,"Psychomotor and Creative Activities","With one or two other pre-primary schools, organise a joint fun learning day with an emphasis on letter sound articulation activities including songs, games, poems and rhymes.","Learners present an outdoor singing game for letter sound articulation during the school assembly.","Oral questions, observation, portfolio","Charts, flash cards, letter cut-outs, letter charts, video clips, ICT devices, radio programs",NULL,"Fluently articulates vowels and consonants, and corresponds letters to sounds appropriately.","Articulates most vowels and consonants correctly and corresponds most letters to sounds appropriately.","Articulates some vowels and consonants correctly and corresponds some letters to sounds appropriately","With guidance, articulates vowel and consonant sounds but has difficulty corresponding letters to sounds."
14,"Pre-Primary One","Language Activities","3.0 Reading","3.1 Book handling skills",NULL,"1 Hour","By the end of the sub-strand, the learner should be able to:
a) Hold a book top side up in and out of school.
b) Demonstrate ability to turn pages from right to left when
opening a page in and out of school.
c) Take pleasure in book handling and storage activities in and out of school.","Learners could be engaged in a book handling activities and be guided to hold books top side up and turn pages from right to left.
Learners could view a video clip depicting holding a book top side up and turning pages from right to left and be guided to imitate.
Learners could sing rhymes related to holding books top side up and turning pages from right to left.
In pairs or small groups, learners could practise dusting, covering and arranging books at appropriate places.","1. How do we hold books when reading?
2. How do you open pages of a book when reading?","Communication and collaboration, digital literacy, learning to learn.","Citizenship: Social integration
Life skills: Creative thinking, critical thinking",Responsibility,"Psychomotor and Creative Activities","Learners could be taken to a library within the community where they practice dusting books and arranging them properly.","Organise an inter-group contest for book handling activities in class.","Oral questions, Observation","Pictures, realia, recorded rhymes, books, video clips, bookshelves",NULL,"Consistently holds the book top side up and sustains orientation of turning pages from right to left.","Holds the book top side up and turns pages from right to left most of the time.","Holds the book top side up and is able to turn pages from right to left sometimes.","With guidance holds the book top side up but does not turn pages from right to left."
15,"Pre-Primary One","Language Activities","3.0 Reading","3.2 Reading readiness skills",NULL,"2 Hours","By the end of the sub-strand, the learner should be able to:
a) Demonstrate left-right eye orientation when reading.
b) Demonstrate top-down orientation skills when reading.
c) Turn pages from right to left when opening a page.
d) Enjoy participating in prereading activities in and out of school.","In pairs or in groups, learners could arrange pictures from left to right.
Learners could view animated pictures that drag and drop from left to right in a digital clip.
Learners could be engaged in a picture walk activity and guided to turn pages from right to left.
Learners could record themselves as they practice turning of pages from right to left and view the video for self-assessment.
Learners could sing rhymes related to left-right and top to bottom eye orientation and turning pages from right to left as they simulate.
In pairs or small groups learners could practise looking at pictures from left to right, moving the eye from top-to-bottom of the page and turning pages from right to left.","1. How do you move your eyes when reading?
2. How do you turn pages of a book when reading?","Digital literacy, learning to learn, communication and collaboration.","Citizenship: Social integration
Life skills: effective communication, self-awareness",Responsibility,"Environmental and Social Activities","organise learners to show case their pre-reading skills to visiting parents during the school open day.","Organise for an inter-group language contest in class that incorporates pre-reading activities.","Observation, oral questions","Video clips, picture books, picture cut-outs, charts, letter cards, objects.",NULL,"Consistently turns pages from right to left, and effectively sustains left to right and top to bottom eye orientation.","Turns pages from right to left and sustains left to right and top to bottom eye orientation most of the time.","Turns pages from right to left most of the time and sustains left to right and top to bottom eye orientation sometimes.","Turns the pages from right to left with guidance but does not demonstrate left to right and top- bottom eye orientation."
16,"Pre-Primary One","Language Activities","3.0 Reading","3.3 Print awareness",NULL,"1 Hour","By the end of the sub-strand, the learner should be able to:
a) Talk about pictures in and out of school.
b) Demonstrate awareness of print in and out of school.
c) Show interest in reading in and out of school.
d) Enjoy reading pictures in and out of school.","Learners could be provided with relevant pictures and encouraged to talk about them.
Learners could answer questions about pictures.
Learners would be engaged in 'read aloud' activities.
Learners could view pictures depicting a story during a read aloud session.
Learners could be guided to view and talk about recorded picture clips and answer questions about them.
Learners could view picture cut outs
depicting stories and be encouraged to
answer questions on the story in pairs or in
small groups.
Learners could be provided with pictures
that capture their attention and be guided to
ask and answer questions about them
Learners could bring pictures from home
to share with others and be encouraged to
ask or answer questions about them.","1. What pictures do you enjoy looking at?
2. What pictures interest learners?","Communication and collaboration, Critical thinking, Digital literacy","Citizenship: Social integration
Life skills: Effective communication",Respect,"Psychomotor and Creative Activities","Take learners or a walk to a nearby road and guide them to fix various road signs they have prepared in class.","Learners to observe and interpret various road signs put around the playground at school.","Oral questions, observation, portfolio","Picture books, read aloud stories, recorded clips of pictures, video clips, charts, ICT devices",NULL,"Consistently demonstrates awareness, observes pictures with sustained attention and talks about them correctly and in detail.","Demonstrates print awareness, observes pictures with attention and talks about them correctly most of the time.","Recognizes print and observes and talks about pictures with attention sometimes.","Recognizes pictures with guidance but has difficulty talking about pictures correctly."
17,"Pre-Primary One","Language Activities","3.0 Reading","3.4 Visual discrimination",NULL,"2 Hours","By the end of the sub-strand, the learner should be able to:
a) Talk about similarities in objects and pictures in class.
b) Talk about differences in objects and pictures in class.
c) Enjoy participating in visual discrimination activities in and out of class.","Learners could be engaged in games that enhance visual discrimination e.g. fixing jigsaw puzzles.
Learners could be engaged in identifying 'odd-one-out' pictures or objects from a set of pictures or objects respectively.
Learners could match and pair objects and pictures.
In pairs or small groups learners could play visual discrimination games, fix jigsaw puzzles among other visual discrimination activities.","1. What are the fun activities that develop visual discrimination in children?
2. What kind of visual discrimination activities do children enjoy?","Communication and collaboration, Learning to learn, Critical and creative thinking","Citizenship: Social integration
Life Skills: Decision making, Critical thinking, Creative Thinking",Unity,"Environmental and Social Activities","Organise to take learners for a visit to a library in the neighbourhood and engage them in activities that incorporate visual discrimination.","Organise an inter-class language contest that incorporates visual discrimination activities.","Oral questions, observations, portfolio","Pictures, animations, realia, video clips, audio clips of rhymes, radio programmes, jig-saw puzzles, charts, flash cards",NULL,"Efficiently recognizes similarities and differences in objects and pictures.","Recognizes similarities and differences in objects and pictures most of the time.","Identifies differences and similarities in objects and pictures sometimes.","Observes without recognizing differences or similarities in objects and pictures."
18,"Pre-Primary One","Language Activities","3.0 Reading","3.5 Visual memory",,"5 Hours","By the end of the sub-strand, the learner should be able to:
a) Recall objects, colours and pictures in class.
b) Recall letters of the alphabet in books and charts.
c) Talk about what they have seen in class.
d) Enjoy participating in visual memory activities in and out of class.","In pairs or small groups, learners could be engaged in visual memory games.
In pairs, learners could be guided to play letter memory games. 
Learners could view items in a learning corner within the class and asked to recall they what they saw.
Learners could be guided to view a video clip showing sets of three to five objects, pictures or letters and be guided to recall the objects, pictures or letters.
Learners could look at pictures on a page for a while, then close the page and recall the pictures they have seen.
In pairs and small groups, learners could be engaged in interactive digital visual memory games.
Learners could be encouraged to recall what they saw e.g.at home or on the way to or from school.","1. What do you see around class?
2. What activities enhance visual discrimination in children?","Communication and collaboration, learning to learn, digital literacy, critical thinking and problem solving.","Citizenship: Social Integration
Life skills: Effective communication, Problem solving, Critical thinking.","Unity, Integrity , Responsibility","Psychomotor and Creative Activities, Environmental and Social Activities","Orgnise for learners to visit a children's home and play visual memory games with the children.","Learners could be guided to walk around the school compound and later recall what they have seen.","Oral questions, observation, portfolio","Language games, pictures, objects, video clips, flashcards, radio programmes, ICT devices",NULL,"Consistently recalls colours, pictures and all letters of the alphabet in class","Recalls colours, pictures and most letters of the alphabet in class.","Recalls colours, pictures and some letters of the alphabet in class.","Is able to recall colours and pictures but not letters of the alphabet in class."
19,"Pre-Primary One","Language Activities","3.0 Reading","3.6 Reading Posture",NULL,"2 Hours","By the end of the sub-strand, the learner should be able to:
a) Demonstrate appropriate reading posture when reading in and out of class.
b) Identify correct reading postures in pictures or in class.
c) Identify incorrect reading postures in pictures or in class.
d) Enjoy participating in reading posture activities in class.","Learners could be encouraged to practise the correct reading posture after observing a demonstration on sitting properly when picture reading.
Learners could be guided to sing songs and recite poems and rhymes related to appropriate reading posture.
Learners could be exposed to models of correct reading posture.
Learners could record themselves as they practise correct reading posture and receive positive feedback.","1. What is appropriate reading posture?
2. What is inappropriate reading posture?","Learning to learn, Digital literacy, Communication and collaboration","Health education: Correct body posture
Life skills Education: Self-awareness, Self esteem","Responsibility, Unity, Respect","Psychomotor and Creative Activities.","Organise for learners to visit a place of worship in a neighbouring religious institution to recite poems, rhymes on correct reading posture.","During a reading session in class. Learners take turns to identify children who are sitting in the correct reading posture. Afterwards they sing for them a reading posture rhyme or song","Oral questions, observation, portfolio","Video clips, picture books, audio clips (for songs, poems, and rhymes), library, chair and table, ICT devices",NULL,"Consistently sits in appropriate reading posture.","Sits and sustains appropriate reading posture.","Sits in appropriate reading posture sometimes.","With guidance, sits appropriately but does not sustain reading posture."
20,"Pre-Primary One","Language Activities","3.0 Reading","3.7 Letter Recognition",NULL,"3 Hours","By the end of the sub-strand, the learner should be able to:
a) Recognize letters of the alphabet in upper case in and out of class.
b) Recognize letters of the alphabet in lower case in and out of class.
c) Match upper case letters with corresponding lower case letters in class.
d) Enjoy participating in
letter recognition activities
in and out of class.","Learners could be guided to identify letters on print in the immediate environment
Learners could be asked to match upper and lower case letters incorporated in children's play to enhance letter recognition.
Learners could fix letter jigsaws.
Learners could be guided to recognize letters on walls, charts, cards and labels to enhance letter recognition.
Learners could sing songs or recite poems and rhymes related to letter recognition while displaying letters.
Individually or in small groups, learners could be engaged in letter recognition games e,g letter fishing games, letter sorting trays, letter basket balls, letter hunting games among thers.
Learners could compete in letter recognition games and encouraged to show fairness in winning and acceptance in loosing.","1. Which play experiences enhance letter recognition?","Learning to learn, digital literacy","Citizenship: Social integration
Life skills: Effective communication, Self esteem","Unity, Peace","Psychomotor and Creative Activities","With the help of parents, learners collect print materials that need to be disposed and take them to school for letter recognition activities.","Organize an inter-group language contest in class, incorporating letter recognition activities.","Oral questions, observations, portfolio","Letter stickers, letter jig-saw, charts, flash cards, talking walls, recorded (poems and rhymes), letter recognition games, letter hunting games, letter sorting trays, ICT devices",NULL,"Consistently recognizes letters in upper and lower case and matches all letters correctly.","Recognizes letters in upper and lower case and can match most of the letters correctly.","Recognizes letters in lower and upper case and can match some of them correctly.","With guidance, recognizes and matches some letters."
21,"Pre-Primary One","Language Activities","4.0 Writing","4.1 Book handling skills",NULL,"1 1/2 Hours","By the end of the sub-strand, the learner should be able to:
a) Demonstrate how to handle books properly
b) Enjoy participating in book handling activities.
c) Participate in storing books properly in and out of school.","Learners could observe as teacher demonstrates how to turn pages from right to left
Learners could be encouraged to practise turning pages from left to right as demonstrated.
Learners could be involved in a writing walk where they turn pages from right to left as they scribble on each page.
In groups, learners could be guided to arrange books on shelves.
Learners could observe a demonstration on how to cover books and imitate.
Learners should practise how to hold a book appropriately whenever opportunities arise.
In groups, learners could practise holding the book up-side-up, sing songs and recite poems and rhymes on how to hold books properly.
Learners could be guided to arrange objects from top to bottom on a page.","1. How do we arrange books on shelves?
2. In what ways do learners mishandle books?
3. How do we take care of books?","Communication and collaboration , Learning to learn","Citizenship: Social integration
Life-skills: (Stewardship) taking care of resources, Effective communication,
peaceful co-existence, Self-awareness","Unity, Responsibility","Environmental and Social Activities","Organise for a visit to a library in the neighbourhood where learners will help in dusting and arranging books.","Organize an inter-group language contest in class that incorporates book handling experiences.","Oral questions, observations","Books, pictures, recorded songs and rhymes, video clips, radio programmes",NULL,"Consistently handles books appropriately and stores books properly.","Handles books appropriately and stores books properly most of the times.","Handles books appropriately and stores books properly sometimes.","Handles books appropriately with guidance."
