pp1.ID,pp1.class,pp1.lrnA,pp1.stn,pp1.sStn,pp1.subSStn,pp1.lsn,pp1.slo,pp1.sle,pp1.kiq,pp1.cc,pp1.pci,pp1.cv,pp1.ola,pp1.csa,pp1.nfa,pp1.asm,pp1.tlr,pp1.nts,pp1.ree,pp1.rme,pp1.rae,pp1.rbe
22,"Pre-Primary One","Language Activities","4.0 Writing","4.2 Writing readiness skills.",NULL,"2 Hours","By the end the sub-strand, learners should be able to:
a) Demonstrate the ability to hold a writing tool properly in and out of class.
b) Scribble from left to right and top to bottom on a page.
c) Turn pages from right to left as they scribble.
d) Take pleasure in prewriting activities in and out of school.","Learners could observe a demonstration on how to turn pages and practise turning pages from right to left.
Learners could practise turning pages from right to left as they scribble on each page.
In groups, learners could be guided to scribble from left to right on a page.
Learners could be encouraged to observe a demonstration on how to hold a writing tool and imitate.
Learners should sing songs and recite poems and rhymes on how to hold writing tools properly as they scribble from top to bottom on a page.
Learners could be engaged in activities where they write patterns freely from left to right across a line while filling each page from the top to the bottom.
Learners could record themselves as they write from left to right and top to bottom on a page and view the video clips for self assessment.","1. How do we hold a writing tool?
2. How do we turn pages in a book?
3. How do we scribble on a page?","Learning to learn, digital literacy, communication and collaboration.","Social Integration
Life skills: Effective Communication","Unity, responsibility.","Environmental and Social Activities","Teacher should organise for learners to show case their pre writing skills to their parents during the school open day.","Arrange for learners to practise pre-writing activities at the language corner in the class using a variety of materials.","Oral questions, observation, portfolio","Books, writing tools, songs, poems, video clips, ICT tools",NULL,"Consistently turns pages from right to left, writes from left to right across the line and effectively sustains eye hand coordination.","Turns pages from right to left, and writes from left to right across the line with sustained eye hand coordination most of the time.","Turns pages from right to left, writes from left to right across the line and coordinates the eye to the hand sometimes.","With guidance, turns pages from left to right but does not demonstrate eye hand coordination."
23,"Pre-Primary One","Language Activities","4.0 Writing","4.3 Writing Posture",NULL,"1 Hour","By the end the sub strand, learners should be able to:
a) Sit appropriately when scribbling, drawing or writing in class.
b) Enjoy participating in activities for writing posture in and out of class.","Encourage learners to practise after demonstrating the appropriate writing posture.
In pairs, learners practise the correct writing posture.
Learners could recite rhymes on the appropriate writing posture as they write.
Learners could view a video clip demonstrating the correct writing posture and practice it.
In pairs and groups learners could practise the appropriate writing posture. 
One of the learners could recite a writing posture rhyme as others practise it.
Learners could be involved in scribbling and drawing and be encouraged to use the appropriate writing posture.","1. How do we sit when writing?
2. How do we position a book when writing?
3. Where do we place our left hand when writing?
4. How do we position the right hand while writing?
5. Where do you place
your feet while
writing?","Communication and collaboration, Learning to learn, Digital literacy.","Citizenship: Social Integration
Life skills Education: Self-awareness, Self esteem",Responsibility,"Psychomotor and Creative Activities","Organise learners to visit a library in the neighbourhood. Guide them to identify those sitting in the correct or incorrect writing posture. They sing the writing posture rhyme or song as they demonstrate.","Organise for learners to participate in an inter-class language contest that incorporates games and play relating to writing posture.","Oral questions, observation, portfolio","Books, video clips, recorded rhymes, poems.",NULL,"Consistently uses correct reading posture with right and left hands well set, legs firmly grounded and book correctly positioned.","Uses correct reading posture with right and left hands well set, legs firmly grounded and book correctly positioned most of the time.","Uses correct reading posture with right and left hands well set, legs firmly grounded and book correctly positioned sometimes","With guidance, positions right and left hands well and legs firmly grounded but does not sustain appropriate writing posture."
24,"Pre-Primary One","Language Activities","4.0 Writing","4.4 Eye-hand coordination skills",NULL,"2 Hours","By the end of the substrand, the learner should be able to:
a) Demonstrate eye-hand coordination when writing.
b) Take pleasure in participating in eyehand coordination activities in class.","The learners could observe the teacher demonstrate folding and tearing or cutting paper along a marked line and practise folding and tearing along a line.
Learners could thread beads and lace through holes on a card.
Learners could practise shading within borders or within shapes.
Learners could prick the edges of shape outlines and cut out the shapes, sort beads, small stones in a tray and practise picking beads from one tray to another.
Learners could be involved in drag and drop activities using digital devices.
Learners could be involved in pegging puzzles and fitting templates.
Learners could be engaged in typing freely on a computer key board.
Learners could practise through free modeling using clay, dough or plasticine.
Learners could play digital games that enhance eye-hand coordination.
Learners could be involved in painting and printing activities, joining dots, and tracing.
Learners sing a song while passing small beads or small stones from one person to the other in a left to right direction.","1. What are the necessary skills for preparing a learner to write?
2. What activities will promote eye hand co-ordination?","Communication and collaboration, Digital literacy, Learning to learn","Citizenship: Social integration
Life skills Education: Self esteem",Unity,"Psychomotor and Creative Activities","Organise for the learners to visit a children's home in the neighbourhood and engage children in eye-hand coordination activities such as modeling, shading, and other singing games that enhance eye-hand coordination.","Organise for an inter-class language contest that incorporates eyehand coordination activities including singing games","Oral questions, observation, portfolio","Books, beads, flashcards, shape cut-outs, stones, stone trays, clay/dough/plasticine, eye hand cording digital games, ICT devices",NULL,"Consistently coordinates eye to hand","Coordinates eye to hand most of the time.","Coordinates eye to hand sometimes. ","Coordinates eye to hand with guidance but does not sustain coordination."
25,"Pre-Primary One","Language Activities","4.0 Writing","4.5 Pattern Writing",NULL,"2 Hours","By the end of the sub-strand, the learner should be able to:
a) Write simple line patterns in class.
b) Use ICT devices to make simple line patterns in class.
c) Hold writing tools appropriately when writing patterns.
d) Enjoy participating in pattern writing activities in class.","Learners could observe the teacher demonstrate writing line patterns in the air and imitate.
Learners could be engaged in tracing simple line patterns.
Learners could be guided to record themselves as they copy patterns and view the clips as they receive positive feedback.
In pairs or small groups, learners could make print patterns using different objects 
Learners could make line patterns using ICT devices such as using the writing wizard and ZEBRA applications.
Learners could copy line patterns on sand trays or slate boards as the teacher demonstrates.","1. Which line patterns are easy for children to write?
2. What materials can children use to form line patterns?
3. What activities would enhance pattern writing skills in children?","Learning to learn, Creativity and imagination, Digital literacy.","Citizenship: Social Integration
Life Skills: Creative thinking","Unity, Responsibility","Psychomotor and Creative Activities","The teacher could organize for learners to make line patterns for display during the school's open day.","Organize an inter-class contest that incorporates pattern writing activities","Oral questions, observation, portfolio","Tracing paper, tracing outline, computers, and objects for printing, ICT devices, flash cards, charts.",NULL,"Consistently arranges objects in a line, forms a variety of print and simple line patterns accurately and holds writing tool appropriately.","Arranges objects in a line, forms print and line patterns accurately and holds writing tool appropriately most of the time.","Arranges objects in line, forms print and simple line patterns accurately and holds writing tool appropriately sometimes.","With guidance, holds writing tools appropriately but does not arrange objects in a line and has difficulty making print and simple line patterns."
26,"Pre-Primary One","Language Activities","4.0 Writing","4.6 Letter formation",NULL,"3 Hours","By the end of the sub-strand, the learner should be able to:
a) Demonstrate ability to form letters correctly in and out of class.
b) Experience pleasure participating in letter formation activities in and out of class.","Learners could sing rhymes related to letter formation.
Learners could observe the teacher demonstrate letter formation in the air, on sand trays, slate boards and imitate.
Learners should sing rhymes related to letter formation as they form letters in the air, on the sand and slate boards.
Learners could be guided to model, colour and paint letters of the alphabet while singing related rhymes.
In pairs or small groups, learners could trace, shade letter outlines or join dots to form letters.
Learners could use ICT devices play letter formation games.
Learners could be guided to record themselves as they practise how to hold the pen and form letters and view the clips as they receive positive feedback.","1. How do you shape letters of the alphabet?
2. What activities are required to develop letter formation skills?","Learning to learn, Communication and collaboration, creativity and imagination","Citizenship: Social integration
Life Skills Education: Self-esteem, Creative thinking",Unity,"Psychomotor and Creative Activities","Involve the parents to help their children in collecting materials formaking print patterns and letter formation activities.","Organise for an outdoor activity session where learners take part in letter formation activities such as arranging flash cards, arranging themselves to form letter outlines or shapes.","Oral questions, observation, portfolio, written assignment","Realia, slates, boards, plasticine/clay, colours, paints, colouring books, ICT devices, letter cut outs, tracing paper.",NULL,"Consistently sustains proper writing-tool grip and forms all letters legibly","Has mastered proper writing tool grip and forms most letters of the alphabet legibly.","Has developed proper writing tool grip and forms some letters of the alphabet correctly.","With guidance, holds writing tool with proper grip but forms letters of the alphabet with difficulty."
27,"Pre-Primary One","Language Activities","4.0 Writing ","4.7 Writing Practice",NULL,"3 Hours","By the end of the sub-strand, the learner should be able to:
a) Demonstrate ability to form letters correctly in and out of class.
b) Experience pleasure participating in letter formation activities in and out of class.","Learners could sing rhymes related to letter formation.
Learners could observe the teacher demonstrate letter formation in the air, on sand trays, slate boards and imitate.
Learners should sing rhymes related to letter formation as they form letters in the air, on the sand and slate boards.
Learners could be guided to model, colour and paint letters of the alphabet while singing related rhymes.
In pairs or small groups, learners could trace, shade letter outlines or join dots to form letters.
Learners could use ICT devices play letter formation games. 
Learners could be guided to record themselves as they practise how to hold the pen and form letters and view the clips as they receive positive feedback.","1. How do you shape letters of the alphabet?
2. What activities are required to develop letter formation skills?","Learning to learn, Communication and collaboration, creativity and imagination","Citizenship: Social integration
Life Skills Education: Self-esteem, Creative thinking",Unity,"Psychomotor and Creative Activities","Involve the parents to help their children in collecting materials for making print patterns and letter formation activities.","Organise for an outdoor activity session where learners take part in letter formation activities such as arranging flash cards, arranging themselves to form letter outlines or shapes.","Oral questions, observation, portfolio, written assignment","Realia, slates, boards, plasticine /clay, colours, paints, colouring books, ICT devices, letter cut outs, tracing paper.",NULL,"Consistently sustains proper writing-tool grip and forms all letters legibly","Has mastered proper writing tool grip and forms most letters of the alphabet legibly.","Has developed proper writing tool grip and forms some letters of the alphabet correctly.","With guidance, holds writing tool with proper grip but forms letters of the alphabet with difficulty."
